company,date,text,num_replies,num_retweets,num_likes
ARW,2019-12-02,Arrow Electronics $ARW Trading Report https://goo.gl/fb/oetxbm Click for Buy/Sell,0,0,0
ARW,2019-12-02,"With the recent launch of $ARW on a couple of new mining pools, check out your options at: http://miningpoolstats.stream/arrow #Arrow ",0,1,18
ARW,2019-12-02,short ratio interest of $ARW is 3.57 at 2019-05-31 http://sunshineavenue.com/stock/ARW/,0,0,0
ARW,2019-12-02,"If you guys are looking for a new mining pool on $ARW, give Dapool a look. Other listed pools can also be found at https://miningpoolstats.stream/arrow",0,0,6
ARW,2019-12-02,"Please welcome  @ArrowCrypto  $ARW as our first supported coin! Still unlisted, very fresh. Join us here",1,3,11
ARW,2019-12-02,"$ARW: Issued Press Release on December 02, 07:00:00: Arrow Electronics Named a 2019 CDW Partner of the Year https://s.flashalert.me/yVG3yW",0,0,0
